url,date_time,category,title,description
https://thebell.io/rynok-ne-vpechatlilsya-ssha-vyvodyat-neft-iz-rezervov-no-tseny-na-syre-rastut,23 ноября 2021,Новости,"«Рынок не впечатлился»: США выводят нефть из резервов, но цены на сырье растут","США и их союзники из числа крупнейших потребителей нефти нанесли свой удар в ценовой войне с ОПЕК+. Белый дом объявил о выводе на рынок 50 млн баррелей нефти из резервов, а с учетом союзников США по внезапно возникшему нефтяному антикартелю эта цифра может вырасти до 75 млн баррелей и выше. Но пока что беспрецедентная скоординированная попытка снизить цены не дает результатов — вместо того чтобы подешеветь, Brent укрепился до $82 за баррель."
https://thebell.io/turetskaya-lira-obnovila-antirekord-posle-vystupleniya-erdogana-v-zashchitu-nizkikh-stavok-3fjO8,23 ноября 2021,Новости,Лира обновила минимум к доллару после защиты Эрдоганом политики низких ставок,"Президент Турции Реджеп Тайип Эрдоган сегодня отправил национальную валюту в очередное пике. В ходе торгов лира рухнула к доллару почти на 12%. На момент написания новости $1 торгуется по 12,7 лиры — курс лиры преодолел порог в 12 лир за доллар впервые с деноминации 2005 года."
https://thebell.io/tseny-na-gaz-v-evrope-vyrosli-iz-za-novykh-sanktsiy-protiv-severnogo-potoka--2-GjlKE,23 ноября 2021,Новости,Цены на газ в Европе выросли из-за новых санкций против «Северного потока — 2»,"Стоимость фьючерсов на газ в Европе во вторник подскочила после того, как США объявили о новых санкциях из-за строительства «Северного потока — 2». Но значительного роста цен аналитики не ждут, потому что газопровод уже достроен и существенного влияния на него санкции не окажут."
https://thebell.io/mir-v-ozhidanii-energokrizisa-chto-stoit-za-rostom-neftegazovyh-tsen-i-kak-dolgo-eto-prodlitsya,22 ноября 2021,The Bell объясняет,Мир в ожидании энергокризиса. Что стоит за ростом нефтегазовых цен и как долго это продлится,"Мир встречает зиму 2021 года в ожидании энергокризиса. Прогноз цены на нефть в $120 к весне 2022-го превращается из экзотики в мейнстрим, а цена на газ в Европе на этой неделе вновь превысила $1000 за тысячу кубометров и пока закрепилась выше этой отметки. Борьба с ростом цен на энергоносители, подстегивающим инфляцию, становится главной темой международной повестки президента США Джо Байдена, обвиняющего в кризисе Россию и ОПЕК. Что стоит за ростом нефтегазовых цен и насколько долгим и глубоким будет кризис?"
https://thebell.io/pochti-dve-treti-rossiyan-nazyvayut-svoe-materialnoe-polozhenie-trudnym-0LcnI,19 ноября 2021,Новости,Почти две трети россиян называют свое материальное положение трудным,"Почти две трети россиян называют свое материальное положение трудным, выяснили исследователи ВШЭ. Только 29% опрошенных рассказали, что месячный доход семьи спокойно позволяет удовлетворять ее основные потребности."
https://thebell.io/eksperty-predupredili-o-dolgom-vozdeystvii-pandemii-na-ekonomiku-rossii-A80YD,19 ноября 2021,Новости,Эксперты предупредили о долгом воздействии пандемии на экономику России,"Низкие темпы вакцинации в России угрожают темпам экономического роста страны, а влияние пандемии на экономику продлится еще долго, считают эксперты S&P. "
https://thebell.io/putin-predlozhil-uvelichit-prozhitochnyy-minimum-i-mrot-na-protsent-bolshe-inflyatsii-H4Ea0,18 ноября 2021,The Bell объясняет,Путин предложил увеличить прожиточный минимум и МРОТ на процент больше инфляции,"Власти реагируют на быстрое ускорение инфляции опережающим ростом социальных выплат. Сегодня Владимир Путин объявил о сверхплановом повышении с 1 января 2022 года прожиточного минимума и МРОТ, от которых отсчитываются социальные пособия и доплаты к пенсиям. Оба показателя будут повышены значительно выше, чем планировалось, на 8,6% — чуть больше, чем прогнозируемая инфляция по итогам года. Обойдется это правителству недорого — всего в 30 млрд рублей."
https://thebell.io/tsb-turtsii-snizil-klyuchevuyu-stavku-na-fone-rekordnogo-obvala-liry-kbaBw,18 ноября 2021,Новости,Турецкая лира упала к доллару после снижения ключевой ставки,"Центральный банк Турции снизил ключевую ставку третий месяц подряд, сообщает Bloomberg. До этого решения турецкая лира, курс которой недавно упал ниже психологического порога в 10 лир за доллар, приблизилась к отметке 11 лир за единицу американской валюты, а после его преодолела. Еще в марте доллар стоил меньше 7 лир."
https://thebell.io/postradayut-samye-nezashchishchennye-nabiullina-predupredila-o-riskakh-dvuznachnoy-prodovolstvennoy-inflyatsii-Ftx2z,18 ноября 2021,Новости,«Пострадают самые незащищенные». Набиуллина предупредила о рисках двузначной продовольственной инфляции,Председатель ЦБ Эльвира Набиуллина заявила о рисках высокой инфляции и призвала снизить рост цен как можно скорее.
https://thebell.io/ssha-poprosili-strany-azii-vysvobodit-chast-nefti-iz-strategicheskikh-rezervov-x6cBR,18 ноября 2021,Новости,США попросили страны Азии высвободить часть нефти из стратегических резервов,"Администрация президента США Джо Байдена попросила некоторых крупных потребителей энергоресурсов, включая Китай, Индию и Японию, высвободить часть нефти из их стратегических резервов, сообщает Reuters со ссылкой на источники. Вашингтон рассчитывает, что это снизит стоимость энергоносителей в мире."
https://thebell.io/nedelnaya-inflyatsiya-v-rossii-snova-uskorilas-mYF7r,17 ноября 2021,Новости,Недельная инфляция в России снова ускорилась,"Недельная инфляция в России на неделе с 9 по 15 ноября вновь ускорилась - до 0,18% с 0,09% на предыдущей неделе, следует из данных Росстата."
https://thebell.io/v-tsb-sprognozirovali-rezkiy-rost-tsen-na-produkty-v-2022-godu-89BvT,17 ноября 2021,Новости,В ЦБ спрогнозировали резкий рост цен на продукты в 2022 году,"В Центробанке предупредили о риске резкого роста цен на продовольствие в следующем году — по словам главы департамента денежно-кредитной политики ЦБ РФ Кирилла Тремасова, это связано с ростом цен на рынке удобрений."
https://thebell.io/belorusskiy-operator-sokratil-prokachku-nefti-v-polshu-po-druzhbe-ctJEq,17 ноября 2021,Новости,Белорусский оператор сократил прокачку нефти в Польшу по «Дружбе»,"Оператор ОАО «Гомельтранснефть Дружба» на трое суток ограничил прокачку нефти по нефтепроводу «Дружба» в направлении Польши, сообщило белорусское агентство «Белта»."
https://thebell.io/inflyatsiya-v-velikobritanii-dostigla-maksimuma-za-10-let,17 ноября 2021,Новости,Инфляция в Великобритании достигла максимума за 10 лет,"Годовая инфляция в Великобритании обновила десятилетний максимум. По итогам ноябрьского заседания Банк Англии сохранил процентную ставку на уровне 0,1%, но на ужесточение денежно-кредитной политики давят все больше факторов."
https://thebell.io/rossiya-narastila-eksport-tovarov-sekretnyh-kategorij-v-strany-nato,17 ноября 2021,Новости,Россия нарастила экспорт товаров секретных категорий в страны НАТО,"В топ-10 получателей товаров секретных категорий из России под кодом SSSS, включая поставки оружия, самолетов и ядерных материалов, вошли шесть стран НАТО, следует из официальной таможенной статистики."
https://thebell.io/tseny-na-gaz-v-evrope-podskochili-bolee-chem-na-18,16 ноября 2021,Новости,Цены на газ в Европе подскочили более чем на 18%,"Цена на газ в Европе превысила $1100 за тысячу кубометров впервые с октября, свидетельствуют данные биржи ICE."
https://thebell.io/ekonomika-rossii-mozhet-ne-doschitatsya-chetverti-rabotnikov-30-40-let-k-2030-godu--bloomberg-6oBdk,16 ноября 2021,Новости, Россия может недосчитаться четверти работников в самом продуктивном возрасте через 10 лет — Bloomberg,"Россия стала единственной страной с развивающейся экономикой, которая до сих пор не смогла восстановить уровень рабочей силы, пишет Bloomberg. Дефицит рук может привести к тому, что к 2030 году страна не досчитается четверти работников самого производительного возраста."
https://thebell.io/nabiullina-ozhidaet-snizheniya-klyuchevoy-stavki-do-6-ne-ranshe-2023-goda-bYZRm,15 ноября 2021,Новости,Набиуллина ожидает снижения ключевой ставки до 6% не раньше 2023 года,"Возвращение к нейтральному уровню ключевой ставки в 5-6% годовых произойдет не раньше середины 2023 года, считает председатель Центробанка Эльвира Набиуллина. По ее словам, для этого инфляция должна вернуться к цели и сохраняться на этом уровне."
https://thebell.io/vedushchie-internet-ploshchadki-rossii-otchitalis-o-prodazhakh-v-den-skidok-7gxu8,15 ноября 2021,Новости,Ведущие интернет-площадки России отчитались о продажах в день скидок,"Российские продажи Ozon в скидочный «день холостяка» 11 ноября выросли больше, чем у конкурентов — Wildberries и Aliexpress. Похоже, что площадка в этот день заметно сблизилась, если не сравнялась с российским конкурентом."
https://thebell.io/mirovoe-bogatstvo-utroilos-za-20-let-za-schet-rosta-tsen-na-nedvizhimost-mckinsey-SLK7h,15 ноября 2021,Новости,Мировое богатство утроилось за 20 лет за счет роста цен на недвижимость — McKinsey,"Мировое богатство утроилось за последние два десятилетия, причем Китай обогнал США и занял первое место. Об этом свидетельствует отчет аналитиков Глобального института McKinsey (MGI), пишет Bloomberg."
https://thebell.io/otelery-poprosili-podderzhki-u-pravitelstva-iz-za-vvedeniya-qr-5gf1P,15 ноября 2021,Новости,Отельеры попросили поддержки у правительства из-за введения QR-кодов ,Гостиничный бизнес первым ощутил на себе последствия введения QR-кодов в регионах и умоляет правительство о поддержке. С выходом кодов на федеральный уровень его примеру последуют другие отрасли. 
https://thebell.io/ssha-i-kitay-dogovorilis-aktivizirovat-usiliya-po-borbe-s-izmeneniem-klimata-DiKOj,11 ноября 2021,Новости,США и Китай договорились активизировать усилия по борьбе с изменением климата,"Вашингтон и Пекин на саммите ООН договорились совместно активизировать усилия по борьбе с изменением климата в ближайшее десятилетие. В частности, страны, которые являются мировыми лидерами по выбросам парниковых газов, условились сокращать выбросы метана."
https://thebell.io/kotirovki-gaza-v-evrope-upali-na-roste-postavok-iz-rossii,10 ноября 2021,Новости,Котировки газа в Европе упали на росте поставок из России,Цены на газ в Европе упали заметно ниже $1000 за тысячу кубометров. На их динамику влияет начавшийся рост поставок из России.
https://thebell.io/banki-v-rossii-dosrochno-pobili-godovoj-rekord-po-vydache-ipoteki,10 ноября 2021,Новости,Банки в России досрочно побили годовой рекорд по выдаче ипотеки,"В январе—октябре банки выдали населению ипотечных кредитов на 4,59 трлн рублей — это больше, чем за весь 2020 год, который стал рекордным для российского рынка ипотеки, сообщает РБК со ссылкой на данные Frank RG. В прошлом году было выдано ипотечных кредитов на 4,49 трлн рублей."
https://thebell.io/kak-investoram-spasatsya-ot-inflyatsii,5 ноября 2021,The Bell объясняет,Наказание для плохого бизнеса. Как инвесторам спастись от инфляции,Растущая инфляция превратилась в главный страх инвесторов по всему миру. Чем она им грозит и можно ли найти спасение?
https://thebell.io/rossiya-prisoedinilas-lish-k-odnoj-initsiative-klimaticheskogo-sammita-v-glazgo,3 ноября 2021,Новости,Россия присоединилась лишь к одной инициативе климатического саммита в Глазго,"Итогами двухдневного саммита по климату в Глазго стали три ключевых документа, которые поддержали десятки стран. Россия присоединилась лишь к одному из них — о защите лесов (что логично — во многом именно за счет лесов страна собирается стать углеродно нейтральной к 2060 году). Скромное участие России, а также Китая в саммите раскритиковали США. Аналитики же в целом больше возлагают надежду в решении климатических проблем на бизнес и финансовый сектор, чем на политику. Рассказываем об основных итогах саммита в Глазго."
https://thebell.io/lidery-g20-odobrili-minimalnuyu-stavku-korporativnogo-naloga-v-15,31 октября 2021,Новости,Лидеры G20 одобрили минимальную ставку корпоративного налога в 15%,"Лидеры стран G20 одобрили соглашение о введении минимального глобального налога для транснациональных корпораций на уровне 15%, сообщает «Би-би-си»."
https://thebell.io/za-chto-raskolnikov-starushku-ubil-finansovaya-podopleka-motiva-pravo-imeyu-v-romane-dostoevskogo-prestuplenie-i-nakazanie,31 октября 2021,Мнения,За что Раскольников старушку убил? Финансовая подоплека мотива «право имею» в романе Достоевского «Преступление и наказание»,"Петербург Достоевского был полон частных ростовщиков: спрос на кредиты был велик, а рынок еще по сути не был сформирован. Кабальные — и по современным меркам, и, главное, по внутреннему ощущению Раскольникова —  условия ссуды привели к печальному исходу.  О финансовой подоплеке мотива «право имею» рассказывает управляющая фондом акций и партнер Movchan's Group Елена Чиркова."
https://thebell.io/moldaviya-dogovorilas-s-gazpromom-o-prodlenii-kontrakta-na-pyat-let,29 октября 2021,Новости,Молдавия договорилась с «Газпромом» о продлении контракта на пять лет,"Молдавия договорилась с «Газпромом» о продлении контракта на поставку газа на пять лет, объявило министерство инфраструктуры страны в Facebook."
https://thebell.io/german-gref-nazval-ipoteku-budushhim-drajverom-rosta-rossijskoj-ekonomiki,26 октября 2021,Новости,Герман Греф назвал ипотеку будущим драйвером роста российской экономики,"Глава Сбербанка Герман Греф назвал рецепт экономического роста России: ипотека и строительство будут усиливать темпы роста ВВП, а с бедностью помогут бороться цифровые технологии, рассказал банкир на встрече с Владимиром Путиным."
https://thebell.io/lira,25 октября 2021,Новости,Курс турецкой лиры обновил исторический минимум после дипломатического конфликта,"Турецкая лира достигла нового минимума после того, как президент Реджеп Эрдоган распорядился выслать послов США и девяти других западных стран, сообщает Reuters."
https://thebell.io/mintrans-predlozhil-povysit-tarify-na-platnyh-dorogah-do-evropejskogo-urovnya,25 октября 2021,Новости,Минтранс предложил повысить тарифы на платных дорогах до европейского уровня,"Минтранс предлагает увеличить тарифы за проезд на платных дорогах в России ради окупаемости новых проектов госкомпании «Автодор», свидетельствует разработанный ведомством законопроект, опубликованный на портале проектов нормативных актов."
https://thebell.io/proizvoditeli-krup-predupredili-o-roste-tsen-v-noyabre,25 октября 2021,Новости,Производители круп предупредили о росте цен в ноябре,"Цены на гречку, овсянку и хлопья могут вырасти на 10–20% в ноябре, сообщает «Коммерсант». О готовящемся подорожании предупредил крупный производитель круп «Роса»."
https://thebell.io/proizvoditeli-predupredili-ritejlerov-o-roste-tsen-na-kolbasu-i-sosiski,22 октября 2021,Новости,Производители предупредили ритейлеров о росте цен на колбасу и сосиски,"Свыше 10 компаний-мясопереработчиков предупредили о повышении цен на продукцию — на 7–20% с конца октября — начала ноября, рассказали «Известиям» в крупных торговых сетях. Кроме прочих, свои уведомления ритейлу направили «Мираторг», «Останкино», «Дымов» и «Клинский»."
https://thebell.io/vladimir-putin-obyavil-nerabochie-dni-s-30-oktyabrya-po-7-noyabrya,20 октября 2021,Новости,Владимир Путин объявил нерабочие дни с 30 октября по 7 ноября,"Президент Путин сегодня обсудил с правительством эпидемиологическую обстановку в стране. Из-за тяжелой ситуации с коронавирусом глава государства объявил дни с 30 октября по 7 ноября нерабочими, традиционно с сохранением заработной платы."
https://thebell.io/belousov-predlozhil-ogranichit-pomoshh-biznesu-vyplatoj-mrot-i-lgotnymi-kreditami,20 октября 2021,Новости,Белоусов предложил ограничить помощь бизнесу выплатой МРОТ и льготными кредитами,"Первый вице-премьер Андрей Белоусов, которому премьер Михаил Мишустин накануне поручил проработать помощь бизнесу, ожидающему потерь от нерабочей недели, предложил пока ограничиться мерами, опробованными в прошлом году, — субсидиями на работников и льготными кредитами. Об этом он доложил президенту Путину на совещании по ситуации с коронавирусом."
