url,date_time,category,title,description
https://thebell.io/evrokomissiya-razreshila-londonskoj-fondovoj-birzhe-pogloshhenie-refinitiv,13 января 2021,Новости,Еврокомиссия разрешила Лондонской фондовой бирже поглощение Refinitiv,Еврокомиссия наконец одобрила заявку Лондонской фондовой биржи (LSE) на поглощение оператора финансовой информации Refinitiv за $27 млрд. 
https://thebell.io/minfin-vozobnovit-pokupki-valyuty-v-yanvare-posle-mnogih-mesyatsev-prodazh,13 января 2021,Новости,Минфин возобновит покупки валюты в январе после многих месяцев продаж,"В январе ожидаемый объем дополнительных нефтегазовых доходов бюджета России составит 73,5 млрд рублей, говорится на сайте Минфина. Поэтому Минфин вернется к закупкам валюты по бюджетному правилу — с апреля 2020 года он продавал валюту из ФНБ."
https://thebell.io/forbes-sostavil-rejting-razbogatevshih-na-roste-bitkoina,12 января 2021,Новости,Forbes составил рейтинг разбогатевших на росте биткоина,"Журнал Forbes составил рейтинг тех, кто разбогател на недавнем росте биткоина. На первом месте известные судом за права на Facebook братья Кэмерон и Тайлер Уинклвосс, основавшие криптовалютную биржу Gemini, где сейчас проводятся сделки примерно на $300 млн ежедневно. Суммарная стоимость их криптовалютных активов — около $2,8 млрд по состоянию на утро 11 января."
https://thebell.io/zoloto-vpervye-v-istorii-oboshlo-dollar-v-rezervah-rossii,11 января 2021,Новости,Золото впервые в истории обошло доллар в резервах России,"Золото в составе международных резервов России впервые обошло по стоимости доллар, следует из статистики Центробанка, на которую обратил внимание РБК. Обзор регулятора публикуется с полугодовым отставанием и отражает ситуацию на середину 2020 года."
https://thebell.io/investfondy-zelenoj-energetiki-okazalis-samymi-dohodnymi-v-2020-godu,11 января 2021,Новости,Инвестфонды зеленой энергетики оказались самыми доходными в 2020 году,"В прошлом году лидерами среди фондов акций США по доходности стали фонды, инвестирующие в компании в сфере чистой энергетики, сообщает VTimes со ссылкой на Financial Times. Паи двух таких фондов выросли в цене более чем в три раза благодаря росту котировок компаний, развивающих солнечную энергетику."
https://thebell.io/krupnejshie-banki-ssha-prekratili-prinimat-vznosy-v-podderzhku-respublikantsev-i-demokratov,11 января 2021,Новости,Крупнейшие банки США прекратили принимать взносы в поддержку республиканцев и демократов,"После беспорядков на Капитолийском холме и захвата Конгресса 6 января два крупнейших банка США и другие компании остановили обработку взносов в комитеты политического действия (political action committee — PAC) или рассматривают этот вопрос, сообщает The Wall Street Journal со ссылкой на источники. PAC — один из главных в США каналов финансирования кандидатов обеих партий на выборах федерального уровня, включая президентские."
https://thebell.io/traektoriya-na-bukvu-k-kakim-budet-vtoroj-god-pandemii,10 января 2021,Мнения,Траектория на букву К: каким будет второй год пандемии,"Дивергенция экономик, отраслей и социальных групп, удаленка как новая норма и «туризм по работе»: наши друзья из Econs.Online рассказывают о главных трендах в экономике 2021 года. С их разрешения публикуем этот материал. "
https://thebell.io/v-rossii-uzhestochili-pravila-kontrolya-za-operatsiyami-s-nalichnymi,10 января 2021,Новости,В России ужесточили правила контроля за операциями с наличными,"С 10 января вступили в силу положения закона, ужесточающего контроль за оборотом наличных средств и безналичных расчетов, сообщает ТАСС."
https://thebell.io/ilon-mask-stal-bogatejshim-chelovekom-planety,7 января 2021,Новости,Илон Маск стал богатейшим человеком планеты,Основатель Tesla Илон Маск стал самым богатым человеком планеты по расчетному размеру состояния. Он сместил с первого места основателя Amazon Джеффа Безоса.
https://thebell.io/rynki-proignorirovali-bunt-vokrug-kapitoliya,7 января 2021,Новости,Рынки проигнорировали бунт вокруг Капитолия,"Рынки очень умеренно отреагировали на захват американского Капитолия сторонниками проигравшего выборы действующего президента Дональда Трампа. Какой бы яркой и трагичной ни была картинка, ничего плохого для экономики не произошло, отмечают аналитики Nasdaq."
https://thebell.io/pochemu-bednye-strany-bedny-glava-iz-knigi-ekonomist-pod-prikrytiem,7 января 2021,Образование,Почему бедные страны бедны. Глава из книги «Экономист под прикрытием»,"Почему бедные страны — бедные? Если задуматься, очевидный ответ (у кого-то больше разнообразных ресурсов, у кого-то — меньше) перестает казаться исчерпывающим. Не все, но некоторые (например, человеческие и технологические) ресурсы можно пополнить. Почему у кого-то получается, у других — нет? Автор книги «Экономист под прикрытием» (новое издание выходит в издательстве «Манн, Иванов и Фербер») Тим Харфорд нашел объяснение в «подмышке Африки»."
https://thebell.io/rossiya-i-saudovskaya-araviya-dostigli-kompromissa-po-dobyche-nefti-wsj,5 января 2021,Новости,Россия и Саудовская Аравия достигли компромисса по добыче нефти — WSJ,"Россия и Саудовская Аравия достигли компромисса по будущему сделки ОПЕК+, страны договорились сохранить текущие условия соглашения в феврале и начать наращивать добычу нефти в марте, пишет The Wall Street Journal со ссылкой на источники."
https://thebell.io/v-top-10-po-rostu-vvp-v-2020-godu-okazalis-sem-stran-afriki,2 января 2021,Новости,В топ-10 по росту ВВП в 2020 году оказались семь стран Африки,"Семь из 10 стран мира с наибольшим ростом ВВП в 2020 году находятся в Африке, пишет Bloomberg."
https://thebell.io/rossiya-snizila-dobychu-nefti-do-urovnya-2011-goda,2 января 2021,Новости,Россия снизила добычу нефти до уровня 2011 года,"Россия в 2020 году снизила добычу нефти на 8,6%, газа — на 6,2% к 2019 году, пишет ТАСС со ссылкой на данные ЦДУ ТЭК. Это значит, что добыча нефти упала до минимума за десятилетие."
https://thebell.io/kak-sostoyatelnye-rossiyane-budut-platit-nalogi-s-2021-goda,1 января 2021,The Bell объясняет,Как состоятельные россияне будут платить налоги с 2021 года,"С 2021 года в России начинает действовать новая система налогообложения — впервые за 20 лет в стране появятся элементы прогрессивной шкалы НДФЛ. Рассказываем, что изменится."
https://thebell.io/analitiki-sberbanka-sprognozirovali-polnoe-vosstanovlenie-ekonomiki-k-2022-godu,29 декабря 2020,Новости,Аналитики Сбербанка спрогнозировали полное восстановление экономики к 2022 году,"Аналитики Сбербанка прогнозируют, что экономика России вернется к докризисным значениям к началу 2022 года и основным ее драйвером станет частный сектор."
https://thebell.io/luchshie-investitsii-goda-vo-chto-stoilo-vlozhitsya-na-martovskom-minimume,28 декабря 2020,The Bell объясняет,Лучшие инвестиции года: во что стоило вложиться на мартовском минимуме,"Индекс S&P 500, падение которого в марте стерло рост последних трех лет, заканчивает сложнейший 2020 год на новом историческом максимуме после одобрения Дональдом Трампом нового пакета стимулов для экономики США на $900 млрд. В выигрыше в этом году оказались инвесторы, не поддавшиеся панике и поставившие на рост рынка — в том числе вполне предсказуемых в пандемию секторов."
https://thebell.io/investfondy-v-2020-godu-vyigrali-na-bigtehe-i-kriptovalyutah,28 декабря 2020,Новости,Инвестфонды в 2020 году выиграли на бигтехе и криптовалютах,"Самые большие потери в 2020 году понесли фонды с сырьевыми, а особенно нефтегазовыми активами в портфелях. Окупились ставки на риск и специализация, пишет Reuters на основе статистики американской информационно-аналитической компании Morningstar."
https://thebell.io/biznes-dinozavry-podvinutsya-andrej-movchan-o-pozitivnyh-itogah-2020-goda,28 декабря 2020,Мнения,«Бизнес-динозавры подвинутся». Андрей Мовчан о позитивных итогах 2020 года,Большинству людей 2020 год хочется поскорее закончить и забыть. Разве было в нем что-то действительно хорошее? Мы задали этот вопрос финансисту Андрей Мовчану — и неожиданно он нашел достаточно позитива.
https://thebell.io/neftyanye-kompanii-ssha-i-evropy-spisali-145-mlrd-menshe-chem-za-god,28 декабря 2020,Новости,Нефтяные компании США и Европы списали $145 млрд меньше чем за год,"Нефтегазовые компании США и Европы за первые три квартала 2020 года списали активов на $145 млрд в связи с беспрецедентным снижением цен на нефть, пишет The Wall Street Journal. Это стало крупнейшей трехквартальной корректировкой по крайней мере за десятилетие, а весь 2020 год обещает стать для отрасли одним из худших в истории."
https://thebell.io/tsb-uvidel-v-massovyh-bankrotstvah-ochishhayushhuyu-silu-pandemii,28 декабря 2020,Новости,ЦБ увидел в массовых банкротствах «очищающую силу» пандемии,"Аналитики ЦБ увидели плюсы в том, что на фоне пандемии все больше компаний ликвидируются: это говорит об «очищающей силе» кризиса, который выталкивает с рынка непроизводительные компании."
https://thebell.io/pravitelstvo-na-god-zapretilo-goszakupki-importnyh-masok,26 декабря 2020,Новости,Правительство на год запретило госзакупки импортных масок,Правительство запретило госзакупки импортных медицинских масок до 31 декабря 2021 года. Ограничение не распространяется на страны ЕАЭС.
https://thebell.io/iz-za-pandemii-kitajskaya-ekonomika-obgonit-amerikanskuyu-na-pyat-let-ranshe,26 декабря 2020,Новости,Из-за пандемии китайская экономика обгонит американскую на пять лет раньше,"Справившись с последствиями пандемии лучше западных стран, Китай обгонит США по размеру экономики на пять лет раньше, чем ожидалось ранее, пишет Bloomberg со ссылкой на прогноз американского Centre for Economics and Business Research (CEBR). "
https://thebell.io/nabiullina-rasskazala-shnurovu-o-smysle-svoih-broshek,26 декабря 2020,Новости,Набиуллина рассказала Шнурову о смысле своих брошек,"Председатель Центробанка Эльвира Набиуллина рассказала Сергею Шнурову в эфире канала RTVI, какой смысл вкладывала в свои брошки на пресс-конференциях после решений регулятора по ключевой ставке. По словам главы ЦБ, ее сигналы не всегда понимали правильно."
https://thebell.io/es-i-velikobritaniya-obyavili-o-torgovom-soglashenii,24 декабря 2020,The Bell объясняет,ЕС и Великобритания объявили о торговом соглашении,"Великобритания все-таки войдет в 2021 год с соглашением о торговле с Евросоюзом. Стороны торговались до последнего, и Великобритании не удалось добиться всех преференций, но это все равно лучше, чем возвращение к стандартному механизму пошлин ВТО и хаосу выхода без сделки."
https://thebell.io/rosselhoznadzor-smyagchil-ogranicheniya-na-import-azerbajdzhanskih-pomidorov,23 декабря 2020,Новости,Россельхознадзор смягчил ограничения на импорт азербайджанских помидоров,"Россельхознадзор смягчает ограничения на импорт помидоров из Азербайджана, введенные с 10 декабря."
https://thebell.io/velikobritanii-ugrozhaet-defitsit-svezhih-ovoshhej-i-fruktov,23 декабря 2020,Новости,Великобритании угрожает дефицит свежих овощей и фруктов,"Из-за спонтанной транспортной блокады, связанной с ограничениями из-за нового штамма коронавируса, жители Великобритании рискуют остаться без свежих овощей и фруктов до самого Нового года. Проблема в разрыве логистических цепочек."
https://thebell.io/tsb-usidel-novyj-rost-obrashhenij-za-restrukturizatsiej-kreditov,21 декабря 2020,Новости,ЦБ увидел новый рост обращений за реструктуризацией кредитов,"Количество обращений россиян в банки за реструктуризацией кредитов снова растет, пишет ЦБ. "
https://thebell.io/budet-li-dollar-dorozhe-85-ekonomisty-o-perspektivah-rublya-pered-novym-godom-i-dalshe,21 декабря 2020,Мнения,Будет ли доллар дороже 85? Экономисты о перспективах рубля перед Новым годом и дальше,"После нескольких недель роста российская валюта снова рухнула — 21 декабря рубль в пике торговался к доллару выше 76 рублей, а к евро — выше 91. О том, ждать ли доллар по 80 и выше, рассказали опрошенные The Bell экономисты."
https://thebell.io/zarplaty-rossiyan-vo-vtoruyu-volnu-koronavirusa-upali-tak-zhe-kak-v-pervuyu,21 декабря 2020,Новости,"Зарплаты россиян во вторую волну коронавируса упали так же, как в первую","Зарплаты россиян во вторую волну пандемии упали так же сильно, как и весной 2020 года, говорится в исследовании «СберИндекса» и сервиса «Работа.ру»."
https://thebell.io/v-ssha-soglasovan-vtoroj-istoricheskij-plan-podderzhki-ekonomiki,21 декабря 2020,Новости,В США согласован второй исторический план поддержки экономики,"Конгресс США согласовал новый план поддержки экономики на $900 млрд в условиях пандемии COVID-19, пишет Bloomberg со ссылкой на законодателей. Это второй по величине пакет стимулов в истории страны, уступающий лишь весеннему раунду вливаний ($2 трлн)."
https://thebell.io/pochti-80-malyh-i-srednih-predpriyatij-okazalis-zavisimymi-ot-kursa-rublya,20 декабря 2020,Новости,Почти 80% малых и средних предприятий оказались зависимыми от курса рубля,"Финансовые показатели 76% предприятий малого и среднего бизнеса в России зависят от динамики курсов на валютных рынках, сообщает РБК со ссылкой на опрос исследовательского агентства Magram Market Research, «Опоры России» и Промсвязьбанка. Каждая четвертая компания, закупающая иностранные комплектующие, вынуждена перекладывать расходы от колебания курса рубля на потребителей."
https://thebell.io/tsena-na-med-ustanovila-semiletnij-rekord,18 декабря 2020,Новости,Цена на медь установила семилетний рекорд,"Цена меди на мировом рынке обновила семилетний максимум и пробила рекордную отметку в $8000 за тонну. Аналитики ведущих компаний Уолл-стрит — Goldman Sachs Group и BlackRock — указывают на начало сырьевого цикла и, соответственно, долгосрочного «бычьего» тренда."
https://thebell.io/nelzya-byt-odnovremenno-gotovymi-ko-vsem-vyzovam-ekonomist-aleksandr-auzan-v-proekte-priblizhaya-budushhee,17 декабря 2020,Интервью,«Нельзя быть одновременно готовыми ко всем вызовам». Экономист Александр Аузан в проекте «Приближая будущее»,"Чем кризис, вызванный пандемией COVID-19, отличается от остальных, зачем развивать культуру неудач, почему офлайн-образование эффективнее и есть ли предел у цифровизации? Об этом и многом другом основатель The Bell и проекта «Русские норм!» Елизавета Осетинская поговорила с деканом экономического факультета МГУ, профессором, общественным деятелем Александром Аузаном. Этот диалог — продолжение нашего совместного с Благотворительным фондом Владимира Потанина проекта «Приближая будущее»."
https://thebell.io/bloomberg-nazval-rossiyu-vtorym-po-perspektivnosti-razvivayushhimsya-rynkom,17 декабря 2020,Новости,Bloomberg назвал Россию вторым по перспективности развивающимся рынком,"Россия стала одним из лидером среди развивающихся рынков по перспективам в 2021 году: согласно исследованию Bloomberg, Россия заняла второе место благодаря хорошему бюджетному профилю и недооцененному рублю."
https://thebell.io/fas-posle-artemeva-stanovitsya-loyalnee-k-monopolistam,17 декабря 2020,The Bell объясняет,ФАС после Артемьева становится лояльнее к монополистам,"Федеральная антимонопольная служба при новом руководителе Максиме Шаскольском будет заметно «травояднее», чем при Игоре Артемьеве, недавно ставшем помощником премьера Михаила Мишустина. Первая ласточка — судьба законопроекта о конкуренции в области интеллектуальной деятельности, пишет «Коммерсант»."
https://thebell.io/nalogovye-lgoty-bogatym-ne-dohodyat-do-ekonomiki-issledovanie,16 декабря 2020,Новости,Налоговые льготы богатым не доходят до экономики — исследование,"Недавнее исследование поставило под сомнение основной принцип trickle-down economics, а именно то, что снижение налогов на самых богатых «просачивается» на нижние уровни. В действительности в последние 50 лет это порождало только рост неравенства без особых благ для экономики, пишет Bloomberg. Практический вывод исследования — правительствам можно увереннее восполнять дефицит бюджета за счет богачей."
