url,date_time,category,title,description
https://thebell.io/sopostavimo-lish-s-mirovymi-vojnami-dmitrij-medvedev-napisal-statyu-o-budushhem-posle-pandemii,17 июня 2020,Новости,«Сопоставимо лишь с мировыми войнами»: Дмитрий Медведев написал статью о будущем после пандемии,"Экс-премьер Дмитрий Медведев написал статью, в которой порассуждал о новых реалиях на фоне пандемии коронавируса и возникших глобальных рисках. Пересказываем главное из статьи нынешнего замглавы Совбеза."
https://thebell.io/ot-tsb-zhdut-rezkogo-snizheniya-klyuchevoj-stavki-na-zasedanii-19-iyunya,17 июня 2020,Новости,От ЦБ ждут резкого снижения ключевой ставки на заседании 19 июня,"На ближайшем заседании регулятор может снизить ключевую ставку с текущих 5,5% сразу на 1 п.п., свидетельствуют консенсус-прогноз Bloomberg и также опрос аналитиков, проведенный РБК. Еще раньше 19 аналитиков и экспертов заявили Reuters, что также ждут снижения ключевой ставки в эту пятницу на 100 б.п., до рекордно низких 4,5%. 10 аналитиков из числа опрошенных Reuters прогнозировали снижение на 50 б.п., два — на 75 б.п."
https://thebell.io/rossijskaya-promyshlennost-ruhnula-v-mae-pochti-na-10,17 июня 2020,Новости,Российская промышленность рухнула в мае почти на 10%,"За май промышленное производство России сократилось на 9,6%, а с начала года падение составило 2,4%, отчитался Росстат. Это максимальное снижение с 2009 года."
https://thebell.io/vzryv-kak-trebovanie-kim-chen-yn-spasaet-ekonomiku-za-schet-konflikta,16 июня 2020,Новости,Взрыв как требование: Ким Чен Ын спасает экономику за счет конфликта,"Мир сегодня обсуждает очередной пик напряженности между Северной и Южной Кореями: КНДР взорвала здание, специально построенное под переговоры стран, а сестра лидера Северной Кореи пригрозила Сеулу войной. Агрессия Севера продиктована желанием поправить пошатнувшуюся экономику и заставить США ослабить санкции."
https://thebell.io/myagkij-karantin-uderzhal-ekonomiku-shvetsii-tolko-ot-rezkogo-padeniya,16 июня 2020,Новости,Мягкий карантин удержал экономику Швеции только от резкого падения,"Аналитики Capital Economics представили аргумент в пользу эффективности мягкого карантина в Швеции, пишет Bloomberg. По их данным, в пике экономика Швеции пострадала от пандемии не так сильно, как страны-соседи, но вопрос в том, не последует ли за этим более длительный спад."
https://thebell.io/ofitsialnaya-bezrabotitsa-v-rossii-podskochila-na-16-za-dve-nedeli-iyunya,15 июня 2020,Новости,Официальная безработица в России подскочила на 16% за две недели июня,"За полмесяца число официально зарегистрированных безработных в России выросло на 16% или на 334 тысячи человек, до 2,42 млн. Об этом сообщил министр труда и социальной защиты России Антон Котяков во время совещания с президентом по поддержке экономики и социальной сферы."
https://thebell.io/morgan-stanley-sprognoziroval-bystryj-vyhod-iz-retsessii,15 июня 2020,Новости,Morgan Stanley спрогнозировал быстрый выход из рецессии,"Мировая экономика перешла в новый цикл развития: к четвертому кварталу 2020 года ее ждет возвращение ВВП на докоронавирусный уровень. А рецессия будет «острой, но короткой», пишет Bloomberg со ссылкой на исследовательскую записку банка от 14 июня."
https://thebell.io/bank-tochka-podschital-padenie-zarplat-v-malom-i-srednem-biznese,15 июня 2020,Новости,Банк «Точка» подсчитал падение зарплат в малом и среднем бизнесе,"Наибольшее сокращение зарплат среди всего малого и среднего бизнеса (МСП) в апреле-мае произошло в секторах культуры, спорта и досуга — на 63%, подсчитал специализирующийся на обслуживании МСП банк «Точка» на основе данных 300 тысяч своих клиентов."
https://thebell.io/krupnyj-biznes-poprosil-u-pravitelstva-rasshireniya-lgot,15 июня 2020,Новости,Крупный бизнес попросил у правительства расширения льгот,"Крупный бизнес просит правительство расширить поддержку системообразующих компаний: предприятия хотят, чтобы им смягчили критерии для получения льготных кредитов и увеличили их лимит, узнали «Ведомости»."
https://thebell.io/chislo-prestuplenij-s-bankovskimi-kartami-v-rossii-vyroslo-v-shest-raz,13 июня 2020,Новости,Число преступлений с банковскими картами в России выросло в шесть раз,"За первые пять месяцев 2020 года количество преступлений, совершенных с использованием банковских карт, выросло в шесть раз, заявила РИА «Новости» официальный представитель МВД России Ирина Волк."
https://thebell.io/tsena-nefti-brent-upala-nizhe-39-za-barrel,11 июня 2020,Новости,Цена нефти Brent упала ниже $39 за баррель,"Цена августовского фьючерса марки Brent опустилась в четверг на 7%, до $38,7 за баррель, котировки нефти WTI — на 8%, до $36,3. Об этом свидетельствуют данные торгов на лондонской бирже ICE."
https://thebell.io/rubl-podros-na-reshenii-frs-sohranit-stavku,10 июня 2020,Новости,Рубль подрос на решении ФРС сохранить ставку,"Рубль к 21.30 мск в среду заметно — на 40 копеек, до 68,2 рубля за доллар, — укрепился к доллару на Forex."
https://thebell.io/rossiya-zhivet-v-svoej-realnosti-konstantin-sonin-o-kontse-pandemii-protestah-v-ssha-i-krizise-kak-v-1990-h,10 июня 2020,Русские норм!,"«Россия живет в своей реальности». Константин Сонин о конце пандемии, протестах в США и кризисе, как в 1990-х","Профессор Чикагского университета и НИУ ВШЭ Константин Сонин — один из самых известных российских экономистов. В интервью YouTube-каналу «Русские норм!» он разобрал антикризисные меры российского правительства, объяснил, почему, по его мнению, правильно было пожертвовать малым и средним бизнесом ради спасения жизней во время пандемии, и назвал уроки, которые России нужно извлечь из американских протестов. Публикуем сокращенную версию. "
https://thebell.io/sberbank-nazval-samye-postradavshie-ot-koronavirusnyh-ogranichenij-regiony,10 июня 2020,Новости,Сбербанк назвал самые пострадавшие от коронавирусных ограничений регионы,"Лаборатория «СберДанные» Сбербанка исследовала влияние ограничительных мер на потребительские расходы. Снижение расходов по регионам оказалось неравномерным, а самыми пострадавшими по этому показателю — столицы."
https://thebell.io/obrazovanie-posle-pandemii-chya-ekonomika-bolshe-i-chem-plohi-ostorozhnye-menedzhery-luchshee-iz-blogov-ekonomistov,9 июня 2020,Мнения,"Образование после пандемии, чья экономика больше и чем плохи осторожные менеджеры — лучшее из блогов экономистов","Развивающиеся рынки рискуют остаться без 30–40% внешних инвестиций, университетам нужны новая сверхидея и более дешевое образование, а компаниям — рисковые менеджеры. Наши коллеги из Econs.Online рассказывают, о чем пишут в своих блогах лучшие экономисты мира. "
https://thebell.io/pochemu-mir-ne-spravilsya-s-pandemiej-vitalij-kazakov-resh-ob-oshibkah-karantina,9 июня 2020,Мнения,Почему мир не справился с пандемией. Виталий Казаков (РЭШ) об уроках карантина,"Никто в мире не был готов к пандемии. Можно ли было бороться с ней более эффективно? Возможно. Но выбор жестких мер, поставивших мировую экономику на грань тяжелейшего кризиса, был во многом предопределен, считает директор программы «Экономика энергетики и природных ресурсов» Российской экономической школы (РЭШ) Виталий Казаков."
https://thebell.io/chetyre-krupnejshih-gosbanka-rossii-vybyli-iz-topa-forbes-po-udobstvu,9 июня 2020,Новости,Четыре крупнейших госбанка России выбыли из топа Forbes по удобству,"Крупнейшие госбанки Сбербанк, ВТБ, Газпромбанк и Россельхозбанк в этом году выбыли из топа самых удобных. Рейтинг составил американский Forbes в сотрудничестве с компанией Statista, оценив банки около 20 стран, пишет российская версия издания."
https://thebell.io/neft-urals-stala-dorozhe-tseny-otsecheniya-v-rossijskom-byudzhete,8 июня 2020,Новости,Нефть Urals стала дороже цены отсечения в российском бюджете,"5 июня, еще до продления действия квот на добычу ОПЕК+, стоимость российской нефти Urals с поставкой в Нидерланды достигла $42,55 за баррель, впервые с начала марта превысила цену отсечения в российском бюджете. Об этом сообщает РБК со ссылкой на данные агентства Argus Media."
https://thebell.io/vsemirnyj-bank-predskazal-padenie-vvp-rossii-na-6-v-2020-godu,8 июня 2020,Новости,Всемирный банк предсказал падение ВВП России на 6% в 2020 году,"В своем докладе «Перспективы мировой экономики» Всемирный банк оценивает снижение ВВП России на 6% в 2020 году из-за вспышки заболеваемости коронавирусом и падения цен на нефть. Мировой показатель может сократится на 5,2%. "
https://thebell.io/kogda-vozobnovyat-polety,8 июня 2020,The Bell объясняет,Россия готовится возобновить международные рейсы: когда и куда можно будет полететь,"Регулярные международные авиарейсы в России остановили еще в марте, но готовятся возобновить. Когда этого ждать и куда можно будет полететь?"
https://thebell.io/kazhdyj-vtoroj-rossiyanin-riskuet-poteryat-rabotu-ili-chast-dohoda,8 июня 2020,Новости,Каждый второй россиянин рискует потерять работу или часть дохода,"Каждый второй россиянин рискует потерять работу или существенную часть дохода, подсчитали аналитики Института социального анализа и прогнозирования РАНХиГС. В группе риска — 35 млн человек. "
https://thebell.io/k-kontsu-2020-goda-v-rossiyu-zhdet-bum-bankrotstv-sliyanij-i-pogloshhenij,8 июня 2020,Новости,"К концу 2020 года Россию ждет бум банкротств, слияний и поглощений","За месяцы пандемии конфликтность российской деловой среды впервые снизилась после непрерывного роста с 2018 года. К концу года эксперты ожидают бум слияний, поглощений и банкротств, пишут «Ведомости»."
https://thebell.io/rosstat-nazval-regiony-s-samymi-vysokimi-srednimi-zarplatami,7 июня 2020,Новости,Росстат назвал регионы с самыми высокими средними зарплатами,"Росстат опубликовал данные по средним зарплатам в регионах за первый квартал 2020 года. В целом по стране средняя зарплата составила В целом по России средняя зарплата составила 48,3 тысячи рублей в месяц."
https://thebell.io/kitaj-razdaet-grazhdanam-vauchery-na-shopping,5 июня 2020,Новости,Китай раздает гражданам ваучеры на шопинг,"Власти китайских городов начали практику раздачи гражданам ваучеров, которые те могут обменять на покупки в магазинах, пишет Bloomberg. По мнению правительства, это должно стимулировать потребительские расходы после обвала из-за пандемии коронавируса."
https://thebell.io/do-dna-i-obratno-kak-biznes-vypolzaet-iz-karantina,5 июня 2020,Истории,До дна и обратно. Как бизнес выползает из карантина,"Российские власти сменили коронавирусную риторику о том, что «пик еще не пройден» на «ситуация стабилизировалась». Но бизнес начал выползать из карантина задолго до этого. The Bell выяснил, когда было пройдено дно, какие отрасли пострадали за время карантина больше всего, а какие, наоборот, выиграли."
https://thebell.io/novaya-vstrecha-stran-opek-projdet-6-iyunya,5 июня 2020,Новости,Нефть Brent подорожала до $42 на новостях о встрече ОПЕК+,"Страны ОПЕК+ приняли решение провести встречу, посвященную сокращению добычи нефти, 6 июня, сообщает Reuters. "
https://thebell.io/rossiya-zanyala-shestnadtsatoe-mesto-po-dole-podderzhki-ekonomiki-v-vvp,4 июня 2020,Новости,Россия заняла шестнадцатое место по доле поддержки экономики в ВВП,"Россия по масштабам поддержки своей экономики оказалась на 16-м месте из 20, согласно подсчетам агентства Fitch (его описывают «Ведомости»): если некоторые развитые страны готовы потратить до 11% от своих ВВП, то правительство России выделило меньше 5%."
https://thebell.io/etsb-sohranil-stavku-rasshiril-programmu-skupki-aktivov,4 июня 2020,Новости,"ЕЦБ сохранил ставку, расширил программу скупки активов","Европейский центробанк (ЕЦБ) сегодня снова сохранил ставки, но увеличил программу экстренной скупки активов на 600 млрд евро. Ее объем достигнет 1,35 трлн евро, а горизонт скупки будет продлен минимум на год, до июня следующего года."
https://thebell.io/razlivsheesya-pod-norilskom-diztoplivo-ne-udalos-ostanovit-pered-ozerom,4 июня 2020,Новости,Разлившееся под Норильском дизтопливо не удалось остановить перед озером,"Попадание дизтоплива в озеро Пясино под Норильском после разлива на ТЭЦ «Норникеля» предотвратить, вероятно, не удалось, узнал «Коммерсант». Уже понятно, что речь о крупнейшем разливе нефтепродуктов в истории российской Арктики — по меньшей мере, известном."
https://thebell.io/eksperty-tsmakp-sprognozirovali-dollar-po-90-i-100-rublej,3 июня 2020,Новости,Эксперты ЦМАКП спрогнозировали доллар по 90 и 100 рублей,"ВВП России в 2020 году может упасть на 8–8,2%, инвестиции в основной капитал — на 19%, а рубль — до 90 рублей за доллар. Таков базовый сценарий экспертов Центра макроэкономического анализа и краткосрочного прогнозирования (ЦМАКП), рассчитанный из предположения второй волны эпидемии коронавируса."
https://thebell.io/tsena-na-neft-brent-podnyalas-vyshe-40-vpervye-za-tri-mesyatsa,3 июня 2020,Новости,Цена на нефть Brent поднялась выше $40 впервые за три месяца,"Цена на фьючерсы на Brent на бирже ICE в ночь на 3 июня впервые после разрыва сделки ОПЕК+ в марте 2020 года превысила $40 за баррель. К 9:00 мск нефть стоила $40,23 (+1,67%)."
https://thebell.io/valyutnyj-kontrol-smyagchat-na-vremya-vosstanovleniya-ekonomiki,3 июня 2020,Новости,Валютный контроль смягчат на время восстановления экономики,"Правительство ослабит меры валютного контроля — эксперты считают, что это один из самых важных пунктов плана на 5 трлн рублей по восстановлению российской экономики после пандемии. "
https://thebell.io/materialnoe-polozhenie-vse-slozhno-tsentr-trudovyh-issledovanij-vshe-o-bezrabotitse-i-padenii-dohodov,2 июня 2020,Мнения,Материальное положение: все сложно. Центр трудовых исследований ВШЭ о безработице и падении доходов,"Российский рынок труда адаптировался к коронакризису, следует из опроса Центра трудовых исследований ВШЭ. Все идет к тому, что экономика избежит взрывного роста безработицы ценой падения трудовых доходов, полагают директор центра Владимир Гимпельсон и его заместитель, член-корреспондент РАН Ростислав Капелюшников. Их совместный текст вышел в издании Econs. Публикуем его с разрешения редакции. "
https://thebell.io/mishustin-predstavil-putinu-plan-vosstanovleniya-ekonomiki-na-5-trln-rublej,2 июня 2020,Новости,Мишустин представил Путину план восстановления экономики на 5 трлн рублей,"Премьер Михаил Мишустин сегодня представил президенту России Владимиру Путину план восстановления экономики России. Разбивки по расходам и каких-то деталей он не дал, но назвал суммарную стоимость."
https://thebell.io/inostrantsam-hotyat-vydavat-rossijskie-zolotye-pasporta-za-sozdanie-rabochih-mest,2 июня 2020,Новости,Иностранцам хотят выдавать российские «золотые паспорта» за создание рабочих мест,"Минэкономразвития разрабатывает критерии, по которым иностранцы смогут получить российские «золотые визы». Вид на жительство правительство хочет давать в обмен на покупку недвижимости, государственных ценных бумаг или открытие собственного дела на территории России, пишет РБК."
https://thebell.io/sotsialnoe-kaznachejstvo-i-pochasovaya-stavka-chto-novogo-v-plane-mishustina,2 июня 2020,Новости,Социальное казначейство и почасовая ставка: что нового в плане Мишустина,"План восстановления экономики от российского правительства можно назвать скорее планом распределения: новых мер поддержки населения, малого и среднего бизнеса в нем так и не появилось, зато есть идея социального казначейства."
https://thebell.io/mishustin-predstavit-putinu-plan-vosstanovleniya-ekonomiki-2-iyunya,1 июня 2020,Новости,Мишустин представит Путину план восстановления экономики 2 июня,"Содержание правительственного плана восстановления экономики станет известно уже завтра, но больших откровений от него ожидать не стоит."
https://thebell.io/mishustin-vklyuchil-smi-v-spisok-postradavshih-otraslej,29 мая 2020,Новости,Мишустин включил СМИ в список пострадавших отраслей,Премьер-министр Михаил Мишустин включил СМИ в перечень наиболее пострадавших отраслей.
https://thebell.io/rossijskaya-ekonomika-v-aprele-ruhnula-na-12,29 мая 2020,Новости,Российская экономика в апреле рухнула на 12%,"В апреле ВВП России снизился на 12% в годовом выражении, сообщается в докладе Минэкономразвития «Картина деловой активности за апрель 2020 года». "
